aw_deep_link,product_name,aw_product_id,merchant_product_id,merchant_image_url,description,merchant_category,search_price,merchant_name,merchant_id,category_name,category_id,aw_image_url,currency,store_price,delivery_cost,merchant_deep_link,language,last_updated,display_price,data_feed_id,brand_name,in_stock,large_image,alternate_image,alternate_image_two,alternate_image_four,alternate_image_three,gender_added,category_added
https://www.awin1.com/pclick.php?p=37759328311&a=2771700&m=12450,"Sleeveless Belted Waist Tailored Mini Dress In Green Woven, Women's Size US 2",37759328311,CLK0720 CHWS0ARDD97 GR#SIZE06,https://cdn.media.amplience.net/i/ego/09-05-24_nor4848_s_feed__99257.jpg?qty=default&fmt=auto&w=450,"Get that office siren look with this dress. Featuring a green woven material, a sleeveless design, a belted waist, a tailored design and a mini length.",Apparel & Accessories > Clothing > Dresses,59,EGO,12450,Women's Dresses & Skirts,198,https://images2.productserve.com/?w=200&h=200&bg=white&trim=5&t=letterbox&url=ssl%3Acdn.media.amplience.net%2Fi%2Fego%2F09-05-24_nor4848_s_feed__99257.jpg%3Fqty%3Ddefault%26fmt%3Dauto%26w%3D450&feedId=68869&k=956b407cf8c4be9b70daefa9e7f75ee3697957e7,USD,,12.99,https://egoshoes.com/us/p/clk0720-sleeveless-belted-waist-tailored-mini-dress-in-green-woven/13126,en,,USD59,68869,EGO,1,,https://cdn.media.amplience.net/i/ego/09-05-24_nor4859_2__16930.jpg,,,,Womens,Dresses
https://www.awin1.com/pclick.php?p=37072320810&a=2771700&m=12450,"Bardot Tailored Detail Blazer Dress In Black, Women's Size US 6",37072320810,CLJ1326 CHWS347BB209 BK#SIZE10,https://cdn.media.amplience.net/i/ego/12-01-24_cin10366_SQ2_feed__30570.jpg?qty=default&fmt=auto&w=450,"Add a chic look to your attire with this dress. Featuring a black material, a bardot neckline and a tailored blazer design.",Apparel & Accessories > Clothing > Dresses,54,EGO,12450,Women's Dresses & Skirts,198,https://images2.productserve.com/?w=200&h=200&bg=white&trim=5&t=letterbox&url=ssl%3Acdn.media.amplience.net%2Fi%2Fego%2F12-01-24_cin10366_SQ2_feed__30570.jpg%3Fqty%3Ddefault%26fmt%3Dauto%26w%3D450&feedId=68869&k=8f0af27c882f61c0c45be775ecdfda84a88f0c3f,USD,,12.99,https://egoshoes.com/us/p/clj1326-bardot-tailored-detail-blazer-dress-in-black/11407,en,,USD54,68869,EGO,1,,https://cdn.media.amplience.net/i/ego/12-01-24_cin10372_sq_3__47099.jpg,,,,Womens,Dresses
https://www.awin1.com/pclick.php?p=40232576637&a=2771700&m=12450,"Sleeveless Belted Waist Tailored Mini Dress In Cream Woven, Women's Size US 8",40232576637,CLK0720 CHWS0ARDD97 CR#SIZE12,https://cdn.media.amplience.net/i/ego/27-06-24_cin0311_s_feed__67001.jpg?qty=default&fmt=auto&w=450,"We are loving the sophistication of this dress doll. Featuring a cream woven material, a sleeveless tailored design, a belted waist and a mini length.",Apparel & Accessories > Clothing > Dresses,56,EGO,12450,Women's Dresses & Skirts,198,https://images2.productserve.com/?w=200&h=200&bg=white&trim=5&t=letterbox&url=ssl%3Acdn.media.amplience.net%2Fi%2Fego%2F27-06-24_cin0311_s_feed__67001.jpg%3Fqty%3Ddefault%26fmt%3Dauto%26w%3D450&feedId=68869&k=81422d435a0783029a1ec4fba742c63afb9d2966,USD,,12.99,https://egoshoes.com/us/p/clk0720-sleeveless-belted-waist-tailored-mini-dress-in-cream-woven/14965,en,,USD56,68869,EGO,1,,https://cdn.media.amplience.net/i/ego/27-06-24_cin0316_p_2__71315.jpg,,,,Womens,Dresses
https://www.awin1.com/pclick.php?p=40099636898&a=2771700&m=12450,"Lace Up Split Front Underwired Maxi Dress In Burgundy Lace, Women's Size US 4",40099636898,CLL1420 CHWS08RDD268 BU#SIZE08,,"Look effortlessly glam in our Lace Up Split Front Underwired Maxi Dress In Burgundy Lace. This burgundy lace dress maxiâ is bold and daring with its sultry spilt front design, underwired support and lace up detail. Want to steal the spotlight? This maxi dress is your secret weapon!",Apparel & Accessories > Clothing > Dresses,68,EGO,12450,Women's Dresses & Skirts,198,https://images2.productserve.com/noimage.gif,USD,,12.99,https://egoshoes.com/us/p/cll1420-lace-up-split-front-underwired-maxi-dress-in-burgundy-lace/20091,en,,USD68,68869,EGO,1,,https://cdn.media.amplience.net/i/ego/14-1-25-Amber_SHORT_AND_SWEET2852_SQ_copy_3__22613.jpg,,,,Womens,Dresses
https://www.awin1.com/pclick.php?p=40783115724&a=2771700&m=12450,"Long Sleeve Cut Out Pocket Detail Tailored Mini Dress In Black, Women's Size US 4",40783115724,CLL1988 ITMYA6295DR BK#SIZE08,https://cdn.media.amplience.net/i/ego/6-3-25-Emily3067_SQ_feed__61970.jpg?qty=default&fmt=auto&w=450,"Bring bold, sleek vibes with our Long Sleeve Cut Out Pocket Detail Tailored Mini Dress In Black. This black cut out dress long sleeveâ brings edgy sophisticated vibes with pocket details and a tailored cut. Style this mini dress with court heels for a fierce fit!",Apparel & Accessories > Clothing > Dresses,60,EGO,12450,Women's Dresses & Skirts,198,https://images2.productserve.com/?w=200&h=200&bg=white&trim=5&t=letterbox&url=ssl%3Acdn.media.amplience.net%2Fi%2Fego%2F6-3-25-Emily3067_SQ_feed__61970.jpg%3Fqty%3Ddefault%26fmt%3Dauto%26w%3D450&feedId=68869&k=76afa4a739b81cfe5214ca8fd2f1b57b20910812,USD,,12.99,https://egoshoes.com/us/p/cll1988-long-sleeve-cut-out-pocket-detail-tailored-mini-dress-in-black/21687,en,,USD60,68869,EGO,1,,https://cdn.media.amplience.net/i/ego/6-3-25-Emily3073_SQ_3__59805.jpg,,,,Womens,Dresses
https://www.awin1.com/pclick.php?p=40232576653&a=2771700&m=12450,"Sleeveless Belted Waist Tailored Mini Dress In Cream Woven, Women's Size US 2",40232576653,CLK0720 CHWS0ARDD97 CR#SIZE06,https://cdn.media.amplience.net/i/ego/27-06-24_cin0311_s_feed__67001.jpg?qty=default&fmt=auto&w=450,"We are loving the sophistication of this dress doll. Featuring a cream woven material, a sleeveless tailored design, a belted waist and a mini length.",Apparel & Accessories > Clothing > Dresses,56,EGO,12450,Women's Dresses & Skirts,198,https://images2.productserve.com/?w=200&h=200&bg=white&trim=5&t=letterbox&url=ssl%3Acdn.media.amplience.net%2Fi%2Fego%2F27-06-24_cin0311_s_feed__67001.jpg%3Fqty%3Ddefault%26fmt%3Dauto%26w%3D450&feedId=68869&k=81422d435a0783029a1ec4fba742c63afb9d2966,USD,,12.99,https://egoshoes.com/us/p/clk0720-sleeveless-belted-waist-tailored-mini-dress-in-cream-woven/14965,en,,USD56,68869,EGO,1,,https://cdn.media.amplience.net/i/ego/27-06-24_cin0316_p_2__71315.jpg,,,,Womens,Dresses
https://www.awin1.com/pclick.php?p=41009848393&a=2771700&m=12450,"Scoop Neck Bodysuit Insert Maxi Dress In Burgundy Lace, Women's Size US 0",41009848393,CLM0421 UKLILDRESS RD#SIZE04,https://cdn.media.amplience.net/i/ego/25-3-25-Emily_M11503_SQ_feed__79476.jpg?qty=default&fmt=auto&w=450,"Demand attention in our Scoop Neck Bodysuit Insert Maxi Dress In Burgundy Lace. This burgundy lace maxi dressââ is seriously sexy with a sleek scoop neck, sheer fabric and bodysuit insert. Style this maxi dress with killer heels for a fierce look!",Apparel & Accessories > Clothing > Dresses,51,EGO,12450,Women's Dresses & Skirts,198,https://images2.productserve.com/?w=200&h=200&bg=white&trim=5&t=letterbox&url=ssl%3Acdn.media.amplience.net%2Fi%2Fego%2F25-3-25-Emily_M11503_SQ_feed__79476.jpg%3Fqty%3Ddefault%26fmt%3Dauto%26w%3D450&feedId=68869&k=a02a236169d70fad6ecc80b17c13e57252ffdf19,USD,,12.99,https://egoshoes.com/us/p/clm0421-scoop-neck-bodysuit-insert-maxi-dress-in-burgundy-lace/22055,en,,USD51,68869,EGO,1,,https://cdn.media.amplience.net/i/ego/25-3-25-Emily_M11508_SQ_copy__79785.jpg,,,,Womens,Dresses
https://www.awin1.com/pclick.php?p=40764734100&a=2771700&m=12450,"Scoop Neck Dropped Hem Detail Midaxi Dress In Yellow, Women's Size US M/L",40764734100,CLL2711 FRGGDRESS YE#SIZEM-L,https://cdn.media.amplience.net/i/ego/6-3-25-Emily2177_SQ_feed__14529.jpg?qty=default&fmt=auto&w=450,Bring the sunny vibes with our Scoop Neck Dropped Hem Detail Midaxi Dress In Yellow. This yellow maxi dress is effortlessly elegant with a sleek scoop neck and dropped hem. Slip into this midaxi dress for your spring style!,Apparel & Accessories > Clothing > Dresses,52,EGO,12450,Women's Dresses & Skirts,198,https://images2.productserve.com/?w=200&h=200&bg=white&trim=5&t=letterbox&url=ssl%3Acdn.media.amplience.net%2Fi%2Fego%2F6-3-25-Emily2177_SQ_feed__14529.jpg%3Fqty%3Ddefault%26fmt%3Dauto%26w%3D450&feedId=68869&k=2adccdb14168c500f5ff45daca1587f03a063d05,USD,,12.99,https://egoshoes.com/us/p/cll2711-scoop-neck-dropped-hem-detail-midaxi-dress-in-yellow/21390,en,,USD52,68869,EGO,1,,https://cdn.media.amplience.net/i/ego/6-3-25-Emily2191_SQ__53260.jpg,,,,Womens,Dresses
https://www.awin1.com/pclick.php?p=40857830391&a=2771700&m=12450,"Mid Rise Maxi Skirt In Cream Crochet, Women's Size US 2",40857830391,CLM021 CHWSWEM212 CR#SIZE06,https://cdn.media.amplience.net/i/ego/LEOPARD_AND_LACE0901_SQ_feed__37801.jpg?qty=default&fmt=auto&w=450,Bring the boho-charm with our Mid Rise Maxi Skirt In Cream Crochet. This cream crochet skirt turns up the glam with a flattering mid rise fit and intricate fabric. Style this maxi skirt with the matching halter top for sun-soaked days!,Apparel & Accessories > Clothing > Skirts,52,EGO,12450,Women's Dresses & Skirts,198,https://images2.productserve.com/?w=200&h=200&bg=white&trim=5&t=letterbox&url=ssl%3Acdn.media.amplience.net%2Fi%2Fego%2FLEOPARD_AND_LACE0901_SQ_feed__37801.jpg%3Fqty%3Ddefault%26fmt%3Dauto%26w%3D450&feedId=68869&k=fc312d80a573a89233ffe5a1bacd71b9847caaca,USD,,12.99,https://egoshoes.com/us/p/clm021-mid-rise-maxi-skirt-in-cream-crochet/21414,en,,USD52,68869,EGO,1,,https://cdn.media.amplience.net/i/ego/11-2-25-Amber8310_SQ__82884.jpg,,,,Womens,Skirts
https://www.awin1.com/pclick.php?p=40857830629&a=2771700&m=12450,"Scoop Neck Bodysuit Insert Maxi Dress In Burgundy Lace, Women's Size US 2",40857830629,CLM0421 UKLILDRESS RD#SIZE06,https://cdn.media.amplience.net/i/ego/25-3-25-Emily_M11503_SQ_feed__79476.jpg?qty=default&fmt=auto&w=450,"Demand attention in our Scoop Neck Bodysuit Insert Maxi Dress In Burgundy Lace. This burgundy lace maxi dressââ is seriously sexy with a sleek scoop neck, sheer fabric and bodysuit insert. Style this maxi dress with killer heels for a fierce look!",Apparel & Accessories > Clothing > Dresses,51,EGO,12450,Women's Dresses & Skirts,198,https://images2.productserve.com/?w=200&h=200&bg=white&trim=5&t=letterbox&url=ssl%3Acdn.media.amplience.net%2Fi%2Fego%2F25-3-25-Emily_M11503_SQ_feed__79476.jpg%3Fqty%3Ddefault%26fmt%3Dauto%26w%3D450&feedId=68869&k=a02a236169d70fad6ecc80b17c13e57252ffdf19,USD,,12.99,https://egoshoes.com/us/p/clm0421-scoop-neck-bodysuit-insert-maxi-dress-in-burgundy-lace/22055,en,,USD51,68869,EGO,1,,https://cdn.media.amplience.net/i/ego/25-3-25-Emily_M11508_SQ_copy__79785.jpg,,,,Womens,Dresses
https://www.awin1.com/pclick.php?p=41398812310&a=2771700&m=12450,"Halterneck Plunge Strappy Detail Split Leg Mini Dress In Black Croc Print Faux Leather, Women's Size US 2",41398812310,CLI454 CHFATF217 BK#SIZE06,https://cdn.media.amplience.net/i/ego/18-10-23_emm3901_s_feed__90706.jpg?qty=default&fmt=auto&w=450,"This dress is everything we're after and more for our weekend fit. Featuring a black croc print faux leather material, a plunge halterneck, strappy detailing and a mini length.",Apparel & Accessories > Clothing > Dresses,54,EGO,12450,Women's Dresses & Skirts,198,https://images2.productserve.com/?w=200&h=200&bg=white&trim=5&t=letterbox&url=ssl%3Acdn.media.amplience.net%2Fi%2Fego%2F18-10-23_emm3901_s_feed__90706.jpg%3Fqty%3Ddefault%26fmt%3Dauto%26w%3D450&feedId=68869&k=4b7086ec5950879dcf7eab4d4a09bf98883c32fa,USD,,12.99,https://egoshoes.com/us/p/cli454-halterneck-plunge-strappy-detail-split-leg-mini-dress-in-black-croc-print-faux-leather/10046,en,,USD54,68869,EGO,1,,https://cdn.media.amplience.net/i/ego/18-10-23_emm3905_s_2__35119.jpg,,,,Womens,Dresses
https://www.awin1.com/pclick.php?p=41437779531&a=2771700&m=12450,"Long Sleeve Belted Blazer Dress In Black Texture, Women's Size US 2",41437779531,CLL1739 CHWSDR08R283 BK#SIZE06,https://cdn.media.amplience.net/i/ego/20-2-25-emily_m12434sq_feed__46782.jpg?qty=default&fmt=auto&w=450,Steal the spotlight in our Long Sleeve Belted Blazer Dress In Black Texture. This black long sleeve blazer dressâ is next-level glam with a cinched belt detail and luxe black textured fabric. Style this blazer dress with kitten heels for instant outfit envy!,Apparel & Accessories > Clothing > Dresses,60,EGO,12450,Women's Dresses & Skirts,198,https://images2.productserve.com/?w=200&h=200&bg=white&trim=5&t=letterbox&url=ssl%3Acdn.media.amplience.net%2Fi%2Fego%2F20-2-25-emily_m12434sq_feed__46782.jpg%3Fqty%3Ddefault%26fmt%3Dauto%26w%3D450&feedId=68869&k=3b7393d11890b62f18975d277157cf5fe7489190,USD,,12.99,https://egoshoes.com/us/p/cll1739-long-sleeve-belted-blazer-dress-in-black-texture/20874,en,,USD60,68869,EGO,1,,https://cdn.media.amplience.net/i/ego/20-2-25-emily_m12442P2__66775.jpg,,,,Womens,Dresses
https://www.awin1.com/pclick.php?p=41510797263&a=2771700&m=12450,"Bandeau Tailored Maxi Dress In White Lace, Women's Size US 0",41510797263,CLL1922 CHWSDR446EH21 WH#SIZE04,https://cdn.media.amplience.net/i/ego/28-1-25-Emily11847_SQ_feed__84522.jpg?qty=default&fmt=auto&w=450,"Turn heads in timeless elegance, doll! This white maxi dress features a tailored bandeau top and a lace skirt, blending sleek structure with delicate detailing. The perfect statement piece for a chic, classy look!",Apparel & Accessories > Clothing > Dresses,54,EGO,12450,Women's Dresses & Skirts,198,https://images2.productserve.com/?w=200&h=200&bg=white&trim=5&t=letterbox&url=ssl%3Acdn.media.amplience.net%2Fi%2Fego%2F28-1-25-Emily11847_SQ_feed__84522.jpg%3Fqty%3Ddefault%26fmt%3Dauto%26w%3D450&feedId=68869&k=3925f8b72e2d93a6fad3135e6dcc84f630ec037c,USD,,12.99,https://egoshoes.com/us/p/cll1922-bandeau-tailored-maxi-dress-in-white-lace/21312,en,,USD54,68869,EGO,1,,https://cdn.media.amplience.net/i/ego/28-1-25-Emily11856_sq__68253.jpg,,,,Womens,Dresses
https://www.awin1.com/pclick.php?p=41510797266&a=2771700&m=12450,"Bandeau Tailored Maxi Dress In White Lace, Women's Size US 2",41510797266,CLL1922 CHWSDR446EH21 WH#SIZE06,https://cdn.media.amplience.net/i/ego/28-1-25-Emily11847_SQ_feed__84522.jpg?qty=default&fmt=auto&w=450,"Turn heads in timeless elegance, doll! This white maxi dress features a tailored bandeau top and a lace skirt, blending sleek structure with delicate detailing. The perfect statement piece for a chic, classy look!",Apparel & Accessories > Clothing > Dresses,54,EGO,12450,Women's Dresses & Skirts,198,https://images2.productserve.com/?w=200&h=200&bg=white&trim=5&t=letterbox&url=ssl%3Acdn.media.amplience.net%2Fi%2Fego%2F28-1-25-Emily11847_SQ_feed__84522.jpg%3Fqty%3Ddefault%26fmt%3Dauto%26w%3D450&feedId=68869&k=3925f8b72e2d93a6fad3135e6dcc84f630ec037c,USD,,12.99,https://egoshoes.com/us/p/cll1922-bandeau-tailored-maxi-dress-in-white-lace/21312,en,,USD54,68869,EGO,1,,https://cdn.media.amplience.net/i/ego/28-1-25-Emily11856_sq__68253.jpg,,,,Womens,Dresses
https://www.awin1.com/pclick.php?p=41510797267&a=2771700&m=12450,"Bandeau Tailored Maxi Dress In White Lace, Women's Size US 4",41510797267,CLL1922 CHWSDR446EH21 WH#SIZE08,https://cdn.media.amplience.net/i/ego/28-1-25-Emily11847_SQ_feed__84522.jpg?qty=default&fmt=auto&w=450,"Turn heads in timeless elegance, doll! This white maxi dress features a tailored bandeau top and a lace skirt, blending sleek structure with delicate detailing. The perfect statement piece for a chic, classy look!",Apparel & Accessories > Clothing > Dresses,54,EGO,12450,Women's Dresses & Skirts,198,https://images2.productserve.com/?w=200&h=200&bg=white&trim=5&t=letterbox&url=ssl%3Acdn.media.amplience.net%2Fi%2Fego%2F28-1-25-Emily11847_SQ_feed__84522.jpg%3Fqty%3Ddefault%26fmt%3Dauto%26w%3D450&feedId=68869&k=3925f8b72e2d93a6fad3135e6dcc84f630ec037c,USD,,12.99,https://egoshoes.com/us/p/cll1922-bandeau-tailored-maxi-dress-in-white-lace/21312,en,,USD54,68869,EGO,1,,https://cdn.media.amplience.net/i/ego/28-1-25-Emily11856_sq__68253.jpg,,,,Womens,Dresses
https://www.awin1.com/pclick.php?p=39060039387&a=2771700&m=12450,"Square Neck Midnight Graphic Print Mini Bodycon Dress In Blue Glitter, Women's Size US S",39060039387,CLL0677 CHSUMMER1028 BU#SIZES,https://cdn.media.amplience.net/i/ego/CLL0677_CHSUMMER1028_BUSQ_feed__98664.jpg?qty=default&fmt=auto&w=450,"This Square Neck Midnight Graphic Print Mini Bodycon Dress In Blue Glitter is the definition of outfit goals. With its sparkly fabric, mini length and eye-catching midnight graphic print, this blue square neck dress is a beautiful statement piece. Perfect for a night out with the girls or a party that lasts until dawn, just pair this bodycon dress with killer heels and let your inner star shine!",Apparel & Accessories > Clothing > Dresses,56,EGO,12450,Women's Dresses & Skirts,198,https://images2.productserve.com/?w=200&h=200&bg=white&trim=5&t=letterbox&url=ssl%3Acdn.media.amplience.net%2Fi%2Fego%2FCLL0677_CHSUMMER1028_BUSQ_feed__98664.jpg%3Fqty%3Ddefault%26fmt%3Dauto%26w%3D450&feedId=68869&k=6977d4ff4e656411ecf7b45ee19bba933b03917f,USD,,12.99,https://egoshoes.com/us/p/cll0677-square-neck-midnight-graphic-print-mini-bodycon-dress-in-blue-glitter/18249,en,,USD56,68869,EGO,1,,https://cdn.media.amplience.net/i/ego/08-10-24_-_CINDY_-_AJ16115_p_4__62425.jpg,,,,Womens,Dresses
https://www.awin1.com/pclick.php?p=41855954532&a=2771700&m=12450,"Mid Rise Maxi Skirt In Cream Crochet, Women's Size US 0",41855954532,CLM021 CHWSWEM212 CR#SIZE04,https://cdn.media.amplience.net/i/ego/LEOPARD_AND_LACE0901_SQ_feed__37801.jpg?qty=default&fmt=auto&w=450,Bring the boho-charm with our Mid Rise Maxi Skirt In Cream Crochet. This cream crochet skirt turns up the glam with a flattering mid rise fit and intricate fabric. Style this maxi skirt with the matching halter top for sun-soaked days!,Apparel & Accessories > Clothing > Skirts,52,EGO,12450,Women's Dresses & Skirts,198,https://images2.productserve.com/?w=200&h=200&bg=white&trim=5&t=letterbox&url=ssl%3Acdn.media.amplience.net%2Fi%2Fego%2FLEOPARD_AND_LACE0901_SQ_feed__37801.jpg%3Fqty%3Ddefault%26fmt%3Dauto%26w%3D450&feedId=68869&k=fc312d80a573a89233ffe5a1bacd71b9847caaca,USD,,12.99,https://egoshoes.com/us/p/clm021-mid-rise-maxi-skirt-in-cream-crochet/21414,en,,USD52,68869,EGO,1,,https://cdn.media.amplience.net/i/ego/11-2-25-Amber8310_SQ__82884.jpg,,,,Womens,Skirts
https://www.awin1.com/pclick.php?p=41867124721&a=2771700&m=12450,"Mid Rise Mini Skirt In Blue Large Disc Sequin, Women's Size US S",41867124721,CLM3741 CHSUSK BL#SIZES,https://cdn.media.amplience.net/i/ego/CLM3741_CHSUSK_BL_10SQ_feed__18591.jpg?qty=default&fmt=auto&w=450,"Turn up the shine in this stunning blue sequin mini skirt. Bold and sparkling, this mini skirt brings an unapologetic energy to your summer holiday outfits . Created with large disc sequins, this skirt channels ocean shades with a dreamy blue hue. The mid-rise fit and mini length are super flattering, while the sequins bring fierce, flirty energy to your outfit. Need concert outfit ideas that stand out in the crowd? Pair this sequin skirt with a sparkly crop top and chunky biker boots . From gigs to girls' trip, this blue sequin mini skirt ensures you shine bright. Key Features Large Disc Sequins Bright Blue Colour Mid Rise Waist Mini Length",Apparel & Accessories > Clothing > Skirts,88,EGO,12450,Women's Dresses & Skirts,198,https://images2.productserve.com/?w=200&h=200&bg=white&trim=5&t=letterbox&url=ssl%3Acdn.media.amplience.net%2Fi%2Fego%2FCLM3741_CHSUSK_BL_10SQ_feed__18591.jpg%3Fqty%3Ddefault%26fmt%3Dauto%26w%3D450&feedId=68869&k=8d885852b4a8fa8e9a0f507ef1cb9b4e4748776d,USD,,12.99,https://egoshoes.com/us/p/clm3741-mid-rise-mini-skirt-in-blue-large-disc-sequin/26597,en,,USD88,68869,EGO,1,,https://cdn.media.amplience.net/i/ego/CLM3741_CHSUSK_BL_12_nc_4__87407.jpg,,,,Womens,Skirts
https://www.awin1.com/pclick.php?p=41898659405&a=2771700&m=12450,"Halterneck Keyhole Detail Floaty Mini Dress In Yellow, Women's Size US L",41898659405,CLM3603 FRLUL1876DR LE#SIZEL,https://cdn.media.amplience.net/i/ego/CLM3603FRLUL1876DR_LE_12_sq_feed__26913.jpg?qty=default&fmt=auto&w=450,"Light up the party, doll! Featuring vibrant yellow fabric with halterneck, keyhole, and floaty detailing, this mini dress serves fresh, chic vibes perfect for sunny days and bold nights out.",Apparel & Accessories > Clothing > Dresses,58,EGO,12450,Women's Dresses & Skirts,198,https://images2.productserve.com/?w=200&h=200&bg=white&trim=5&t=letterbox&url=ssl%3Acdn.media.amplience.net%2Fi%2Fego%2FCLM3603FRLUL1876DR_LE_12_sq_feed__26913.jpg%3Fqty%3Ddefault%26fmt%3Dauto%26w%3D450&feedId=68869&k=645a1c9220b2cb9a8985fcf73d4a69c2eb4429ad,USD,,12.99,https://egoshoes.com/us/p/clm3603-halterneck-keyhole-detail-floaty-mini-dress-in-yellow/25898,en,,USD58,68869,EGO,1,,https://cdn.media.amplience.net/i/ego/CLM3603FRLUL1876DR_LE_14_NC_2__67017.jpg,,,,Womens,Dresses
https://www.awin1.com/pclick.php?p=41898659591&a=2771700&m=12450,"Mid Rise Fishtail Maxi Skirt In White Crochet Lace, Women's Size US 2",41898659591,CLM2907 CHWSEGCO08RDD152COSK WH#SIZE06,https://cdn.media.amplience.net/i/ego/clm2907_chwsegco08rdd152cosk_wh_sq_feed__75503.jpg?qty=default&fmt=auto&w=450,"Serve boho chic, doll! Featuring crisp white crochet lace with mid-rise fit and fishtail detailing, this maxi skirt brings fresh, playful vibes perfect for effortless standout style.",Apparel & Accessories > Clothing > Skirts,51,EGO,12450,Women's Dresses & Skirts,198,https://images2.productserve.com/?w=200&h=200&bg=white&trim=5&t=letterbox&url=ssl%3Acdn.media.amplience.net%2Fi%2Fego%2Fclm2907_chwsegco08rdd152cosk_wh_sq_feed__75503.jpg%3Fqty%3Ddefault%26fmt%3Dauto%26w%3D450&feedId=68869&k=58ebeab5226b935acfa12f8078ccd1bc3c307169,USD,,12.99,https://egoshoes.com/us/p/clm2907-mid-rise-fishtail-maxi-skirt-in-white-crochet-lace/26302,en,,USD51,68869,EGO,1,,https://cdn.media.amplience.net/i/ego/CLM3335_UKLIL1844DR_WH-_25_nc__41499.jpg,,,,Womens,Skirts
https://www.awin1.com/pclick.php?p=41898659888&a=2771700&m=12450,"Mid Rise Floral Embroidered Tassel Hem Detail Mini Skirt In Pink, Women's Size US 2",41898659888,CLM0589 CHWSEGBT503MB201SK RD#SIZE06,,"Step into summer sweetness with this pink mini skirt, featuring soft fabric and mid rise fit with floral embroidered tassel hem detailing. Perfect for dolls who love bold, chic vibes with a playful twist.",Apparel & Accessories > Clothing > Skirts,67,EGO,12450,Women's Dresses & Skirts,198,https://images2.productserve.com/noimage.gif,USD,,12.99,https://egoshoes.com/us/p/clm0589-mid-rise-floral-embroidered-tassel-hem-detail-mini-skirt-in-pink/26306,en,,USD67,68869,EGO,1,,https://cdn.media.amplience.net/i/ego/CLM0589_CHSEGBT503MB201SK_RD-_17_nc_2__26673.jpg,,,,Womens,Skirts
https://www.awin1.com/pclick.php?p=41898661104&a=2771700&m=12450,"Bandeau Tailored Maxi Dress In Black Lace, Women's Size US 2",41898661104,CLL1922 CHWSDR BK#SIZE06,https://cdn.media.amplience.net/i/ego/CLL1922_CHWSDR_BK-_7_SQ_feed__34758.jpg?qty=default&fmt=auto&w=450,"Turn up the drama, doll! Featuring black lace with tailored detailing, this bandeau maxi dress brings chic sophistication and bold vibes perfect for nights that demand all eyes on you.",Apparel & Accessories > Clothing > Dresses,54,EGO,12450,Women's Dresses & Skirts,198,https://images2.productserve.com/?w=200&h=200&bg=white&trim=5&t=letterbox&url=ssl%3Acdn.media.amplience.net%2Fi%2Fego%2FCLL1922_CHWSDR_BK-_7_SQ_feed__34758.jpg%3Fqty%3Ddefault%26fmt%3Dauto%26w%3D450&feedId=68869&k=bc469e64e3af7e0fb169e0c9d13bc6ecf2134b27,USD,,12.99,https://egoshoes.com/us/p/cll1922-bandeau-tailored-maxi-dress-in-black-lace/25773,en,,USD54,68869,EGO,1,,https://cdn.media.amplience.net/i/ego/CLL1922_CHWSDR_BK-_11_copy_3__94374.jpg,,,,Womens,Dresses
https://www.awin1.com/pclick.php?p=41928282383&a=2771700&m=12450,"Strappy Floaty Mini Dress In Black, Women's Size US L",41928282383,CLM2603 FRLUDR BK#SIZEL,https://cdn.media.amplience.net/i/ego/CLM2603_FRLUDR_BK_4_sq_feed__60248.jpg?qty=default&fmt=auto&w=450,"Packing your beach holiday evening outfits? Don't forget about this black floaty mini dress. Flowy and flirty, this little black dress features a peephole halter neckline, barely-there straps, and a sexy open back design to show just the right amount of skin. Made from soft, black chiffon fabric, this mini dress feels weightless and flatters your figure with its floaty silhouette. Make this black floaty mini dress the moment by styling it with your favourite gold earrings and bracelets paired with ankle strap kitten heels . Cute and classy, everyone needs a dress like this in their warm-weather wardrobe. Key Features Black Colour Peephole Halter Neckline Chiffon Fabric Trapeze Style Mini Length Loose Fit",Apparel & Accessories > Clothing > Dresses,56,EGO,12450,Women's Dresses & Skirts,198,https://images2.productserve.com/?w=200&h=200&bg=white&trim=5&t=letterbox&url=ssl%3Acdn.media.amplience.net%2Fi%2Fego%2FCLM2603_FRLUDR_BK_4_sq_feed__60248.jpg%3Fqty%3Ddefault%26fmt%3Dauto%26w%3D450&feedId=68869&k=e4fc4f5baba794be370fc879321a6839fa122a9d,USD,,12.99,https://egoshoes.com/us/p/clm2603-strappy-floaty-mini-dress-in-black/27199,en,,USD56,68869,EGO,1,,https://cdn.media.amplience.net/i/ego/CLM2603_FRLUDR_BK_5_2__43437.jpg,,,,Womens,Dresses
